{
  "schema": "distributed_world_simulator.project_epoch.v1",
  "epoch_id": "E2026-08-11-H0-1-R6",
  "base_sha": "1112d1f7cfad1df18fb3621a537e191e674848c6",
  "registry_generation": 75,
  "architecture_revision": "GLOBAL-P0-2026-08-10-R2",
  "harness_revision": "H0-2026-08-11-R1",
  "created_at_utc": "2026-08-11T14:22:00Z",
  "eligible_checkpoints": ["H0_1_CLOSED_LOOP_C22_PILOT"],
  "status": "ACTIVE",
  "decision": "CONTINUE"
}
