{
  "schema": "distributed_world_simulator.project_epoch.v1",
  "epoch_id": "E2026-08-30-V0-P7-R1",
  "base_sha": "acb9379cacc413fc25a65117fb1627f5a01b9736",
  "registry_generation": 80,
  "architecture_revision": "GLOBAL-P0-2026-08-12-R3-REFRESH-R1",
  "harness_revision": "H0-2026-08-11-R1",
  "created_at_utc": "2026-08-30T04:06:00Z",
  "eligible_checkpoints": [
    "V0_P7_BOUNDED_TERRAIN_MUTATION"
  ],
  "status": "ACTIVE",
  "decision": "CONTINUE"
}
