{
  "schema": "distributed_world_simulator.project_epoch.v1",
  "epoch_id": "E2026-08-11-H0-0-R2",
  "base_sha": "40c117bb16a635b03acfbaa7d9fe18b74245c989",
  "registry_generation": 66,
  "architecture_revision": "GLOBAL-P0-2026-08-10-R2",
  "harness_revision": "H0-2026-08-11-R1",
  "created_at_utc": "2026-08-11T09:32:00Z",
  "eligible_checkpoints": [
    "H0_0_SCAFFOLD_READY"
  ],
  "status": "INVALIDATED",
  "invalidated_by_main_sha": "9ad18eab0a1361bc3efcd38a19027880aac4e339",
  "decision": "REFRESH_REQUIRED"
}
