{
  "schema": "distributed_world_simulator.project_epoch.v1",
  "epoch_id": "E2026-08-21-ECO-E3-6-R1",
  "base_sha": "bb1e62532a51841a29b5dd680d0f0f435cfc003d",
  "registry_generation": 80,
  "architecture_revision": "GLOBAL-P0-2026-08-10-R2",
  "harness_revision": "H0-2026-08-11-R1",
  "created_at_utc": "2026-08-21T05:40:00Z",
  "eligible_checkpoints": [
    "ECO_EVO3_E3_6_SEASONAL_DISTURBANCE_TEMPORAL_PROGRAM"
  ],
  "status": "ACTIVE",
  "decision": "CONTINUE"
}
